{
  "version": "2.0.0-alpha.1",
  "stage": "alpha",
  "release_scope": "engine-only",
  "engine_commit": "8bd33a91343603434026408aded2de0142989159",
  "engine_ci": [
    {
      "workflow_name": "ci-self-test",
      "repository": "bogdaniel/sentinel-shield",
      "commit": "8bd33a91343603434026408aded2de0142989159",
      "event": "push",
      "workflow_run_id": 28542231786,
      "workflow_url": "https://github.com/bogdaniel/sentinel-shield/actions/runs/28542231786",
      "result": "success",
      "artifacts": [
        { "id": 8020375110, "name": "sentinel-shield-self-test-reports", "verified": true }
      ],
      "artifacts_verified": true,
      "verified_at": "2026-07-01T21:31:42Z",
      "verification_method": "github-api"
    },
    {
      "workflow_name": "ci-pipeline",
      "repository": "bogdaniel/sentinel-shield",
      "commit": "8bd33a91343603434026408aded2de0142989159",
      "event": "push",
      "workflow_run_id": 28542231713,
      "workflow_url": "https://github.com/bogdaniel/sentinel-shield/actions/runs/28542231713",
      "result": "success",
      "artifacts": [
        { "id": 8020393036, "name": "sentinel-shield-release-evidence", "verified": true },
        { "id": 8020389107, "name": "sentinel-shield-security-summary", "verified": true },
        { "id": 8020386118, "name": "sentinel-shield-sbom", "verified": true }
      ],
      "artifacts_verified": true,
      "verified_at": "2026-07-01T21:31:42Z",
      "verification_method": "github-api"
    },
    {
      "workflow_name": "ci-security",
      "repository": "bogdaniel/sentinel-shield",
      "commit": "8bd33a91343603434026408aded2de0142989159",
      "event": "push",
      "workflow_run_id": 28542231769,
      "workflow_url": "https://github.com/bogdaniel/sentinel-shield/actions/runs/28542231769",
      "result": "success",
      "artifacts": [
        { "id": 8020383400, "name": "sentinel-shield-security-summary", "verified": true },
        { "id": 8020383135, "name": "sentinel-shield-raw-security", "verified": true }
      ],
      "artifacts_verified": true,
      "verified_at": "2026-07-01T21:31:42Z",
      "verification_method": "github-api"
    },
    {
      "workflow_name": "ci-workflow-lint",
      "repository": "bogdaniel/sentinel-shield",
      "commit": "8bd33a91343603434026408aded2de0142989159",
      "event": "push",
      "workflow_run_id": 28542231729,
      "workflow_url": "https://github.com/bogdaniel/sentinel-shield/actions/runs/28542231729",
      "result": "success",
      "artifacts": [],
      "artifacts_verified": false,
      "verified_at": "2026-07-01T21:31:42Z",
      "verification_method": "github-api"
    }
  ],
  "consumer_runs": [],
  "required_evidence": {
    "laravel": false,
    "symfony": false,
    "php_library": false,
    "node_react": false,
    "combined_profile": false,
    "bootstrap_apply": false,
    "rollback_npm": false,
    "rollback_pnpm": false,
    "rollback_yarn": false
  }
}
